{
  "schemaVersion": 2,
  "behaviorMatrix": [
    {
      "id": "evidence-operation-isolation",
      "behavior": "Every deterministic evidence operation runs against its own read-only candidate snapshot and proves the snapshot did not change.",
      "kind": "boundary",
      "input": "two sequential evidence operations where the first attempts a candidate write",
      "preconditions": "the exact scoped candidate can be materialized",
      "expected": "the write is runtime-incomplete, tree attestation remains explicit, and the next operation observes a pristine candidate",
      "risk": "high",
      "disposition": "automated",
      "providerIds": ["review-evidence-tests"]
    },
    {
      "id": "provider-cell-authority",
      "behavior": "Only a provider declared by a behavior cell, with the reciprocal cell declaration, may satisfy that cell.",
      "kind": "boundary",
      "input": "one-way or forged provider-to-cell evidence",
      "preconditions": "manifest and evidence records are runtime validated",
      "expected": "one-way declarations fail validation and forged records remain coverage gaps",
      "risk": "high",
      "disposition": "automated",
      "providerIds": ["review-evidence-tests"]
    },
    {
      "id": "evidence-runner-state-isolation",
      "behavior": "Every operation receives unique HOME and TMPDIR state, and prior operation residue is removed before the next operation.",
      "kind": "boundary",
      "input": "one operation writes a runner-state sentinel and the next probes for it",
      "preconditions": "operations execute sequentially",
      "expected": "the second operation cannot observe the first operation's HOME or TMPDIR content",
      "risk": "high",
      "disposition": "automated",
      "providerIds": ["review-evidence-tests"]
    },
    {
      "id": "regression-red-oracle",
      "behavior": "A regression RED operation succeeds only on its declared exact non-zero exit code.",
      "kind": "exception",
      "input": "expected RED exit 42 but process, dependency, or sandbox exits differently",
      "preconditions": "a regression provider declares base RED and candidate GREEN",
      "expected": "unexpected non-zero exits cannot become verified-pass evidence",
      "risk": "high",
      "disposition": "automated",
      "providerIds": ["review-evidence-tests"]
    },
    {
      "id": "deterministic-classification-authority",
      "behavior": "Only deterministic runtime findings may carry verified-failure classification.",
      "kind": "branch",
      "input": "semantic output references a failed evidence record",
      "preconditions": "deterministic evidence has already been evaluated",
      "expected": "semantic output remains a semantic concern and cannot promote itself to verified failure",
      "risk": "high",
      "disposition": "automated",
      "providerIds": ["review-evidence-tests"]
    },
    {
      "id": "deterministic-finding-preservation",
      "behavior": "Runtime-owned verified failures remain blocking through semantic normalization and Work Map readback.",
      "kind": "branch",
      "input": "a typed candidate operation violates its declared exit contract",
      "preconditions": "semantic review runs after deterministic evidence",
      "expected": "the final artifact retains verified-failure and Work Map requests changes",
      "risk": "high",
      "disposition": "automated",
      "providerIds": ["review-evidence-tests", "work-map-review-tests"]
    },
    {
      "id": "evidence-host-eligibility",
      "behavior": "Incomplete high-risk evidence blocks the semantic host while complete evidence permits exactly one initial call.",
      "kind": "branch",
      "input": "complete and incomplete high-risk behavior matrices",
      "preconditions": "deterministic providers have finished",
      "expected": "host eligibility is derived from typed completeness and an ineligible run makes zero host calls",
      "risk": "high",
      "disposition": "automated",
      "providerIds": ["review-evidence-tests"]
    },
    {
      "id": "pre-semantic-evidence-repair",
      "behavior": "A deterministic-only blocker lineage can repair typed evidence before its first semantic host call without replacing lineage authority.",
      "kind": "exception",
      "input": "an authoritative hostCallCount=0 artifact, a repaired candidate, and an optional monotonic contract strengthening",
      "preconditions": "all unresolved findings came from deterministic evidence and the predecessor receipt is current and unclaimed",
      "expected": "the runtime reruns only affected typed evidence, preserves predecessor provenance, keeps failed repair blockers open, and dispatches exactly one initial semantic host only after evidence becomes eligible",
      "risk": "high",
      "disposition": "automated",
      "providerIds": ["review-evidence-tests", "installed-runtime-tests"]
    },
    {
      "id": "scoped-closure-rerun",
      "behavior": "Closure reruns affected behavior contracts and closes only original findings with fresh matching evidence.",
      "kind": "normal",
      "input": "initial artifact, repaired candidate, and optionally changed behavior manifest",
      "preconditions": "initial semantic review produced stable finding IDs",
      "expected": "closure uses one separate host call and emits a typed review-closure artifact",
      "risk": "high",
      "disposition": "automated",
      "providerIds": ["review-evidence-tests"]
    },
    {
      "id": "compact-closure-delta",
      "behavior": "Separated repairs are represented as bounded multi-hunk delta without unchanged middle content.",
      "kind": "boundary",
      "input": "two repairs separated by a large unchanged patch region",
      "preconditions": "original and repaired candidate patches are available",
      "expected": "the closure prompt receives compact hunks and never the original full patch",
      "risk": "medium",
      "disposition": "automated",
      "providerIds": ["review-evidence-tests"]
    },
    {
      "id": "closure-evidence-relevance",
      "behavior": "A closure result can cite only fresh rerun records whose authorized behavior cells intersect the original finding.",
      "kind": "boundary",
      "input": "a finding for cell A and a passing rerun record for cell B",
      "preconditions": "closure validates stable original finding IDs",
      "expected": "the unrelated record cannot close the finding",
      "risk": "high",
      "disposition": "automated",
      "providerIds": ["review-evidence-tests"]
    },
    {
      "id": "persisted-artifact-revalidation",
      "behavior": "Persisted evidence records and completeness are reconstructed from the manifest contract before closure reuse.",
      "kind": "exception",
      "input": "an automated cell with a forged disposition pass or forged completeness projection",
      "preconditions": "an initial review artifact is loaded",
      "expected": "artifact validation rejects the forged record or projection before closure",
      "risk": "high",
      "disposition": "automated",
      "providerIds": ["review-evidence-tests"]
    },
    {
      "id": "runtime-owned-initial-receipt",
      "behavior": "Closure accepts an initial artifact only when an unspent installed-runtime receipt matches its full payload and review scope, and Work Map readback proves the immediately following repair attempt.",
      "kind": "boundary",
      "input": "caller-edited findings, evidence, timestamps, host count, Work Map scope, or a receipt from a prior claim attempt",
      "preconditions": "an initial artifact path is supplied for closure",
      "expected": "missing, spent, stale, cross-scope, prior-attempt, or mismatched receipts fail before evidence execution or Work Map transition, and the validated receipt is atomically claimed at most once",
      "risk": "high",
      "disposition": "automated",
      "providerIds": ["review-evidence-tests", "installed-runtime-tests"]
    },
    {
      "id": "evidence-default-deny-read",
      "behavior": "Evidence commands can read only their candidate, isolated runner state, executable runtime libraries, and declared project dependencies.",
      "kind": "boundary",
      "input": "an evidence command attempts to read a file outside all declared roots",
      "preconditions": "the macOS Seatbelt runner is available",
      "expected": "the outside read is denied while the declared evidence operation still runs deterministically",
      "risk": "high",
      "disposition": "automated",
      "providerIds": ["review-evidence-tests"]
    },
    {
      "id": "evidence-system-log-deny",
      "behavior": "The macOS process startup baseline cannot reopen network, system socket, or Mach service output channels for evidence commands.",
      "kind": "boundary",
      "input": "an evidence command attempts to connect to the local system log socket or look up a baseline Mach service",
      "preconditions": "the common system process baseline is imported before Goldband-specific denies",
      "expected": "the socket connection and global-name Mach lookup are denied, every imported common Mach allow clause has an exact deny contract including registration and XPC prefixes, and no candidate bytes leave through the live-probed channels",
      "risk": "high",
      "disposition": "automated",
      "providerIds": ["review-evidence-tests"]
    },
    {
      "id": "sealed-runtime-projection",
      "behavior": "A dynamically linked evidence runtime executes from a sealed per-review projection instead of reading its original host package tree.",
      "kind": "boundary",
      "input": "a Homebrew Node runtime with transitive non-system Mach-O dependencies and host OpenSSL configuration",
      "preconditions": "every source image and dependency edge can be resolved and content-attested before execution",